{
  "id": "wh-2c4f8e1a-3b5d-4e6f-8a9c-1b2d3e4f5a6b",
  "displayName": "iModel changeset push notifications",
  "eventTypes": [
    "iModelChangesetPushed",
    "NamedVersionCreated"
  ],
  "deliveryUrl": "https://example.com/webhooks/bentley-itwin",
  "state": "Active",
  "createdDateTime": "2026-02-14T10:00:00Z"
}